<?xml version="1.0" encoding="ISO-8859-1"?>
<!-- 	Tabular output with some meta information, so use a dedicated format for this driven by a schema -->
<!-- 	we choose not to adopt the existing tabular w3 schema approach (http://www.w3.org/TR/tabular-metadata/) which also works with csv because their scheme is defined in json 
		and it does not cater for structured meta data unrelated to the columns apart from a general description (it seems) -->
<metadata
 xmlns:xsi="http://www.w3.org/2001/XMLSchema-instance"
 xsi:noNamespaceSchemaLocation="linkmetadata.xsd">
	<timestamp>2019-02-05T11:38:24</timestamp>
	<version>0.0.1</version>	
	<description>description of this particular link output</description>
	<outputconfiguration>
		<assignment>traditional static assignment</assignment>
		<physicalcost>BPR</physicalcost>
		<virtualcost>fixed</virtualcost>
		<timeperiod>
			<id>1</id>
			<name>morning peak 6-9</name>			
		</timeperiod>
	</outputconfiguration>
	<simulation>
		<iteration>
			<nr>1</nr>
			<csvdata>linkdata_i1.csv</csvdata>
		</iteration>
	</simulation>
	<columns>
		<column>
			<name>link id</name>
			<unit>none</unit>
			<type>integer</type>				
		</column>
		<column>
			<name>mode id</name>
			<unit>none</unit>
			<type>integer</type>				
		</column>
		<column>
			<name>speed</name>
			<unit>km/h</unit>
			<type>float</type>				
		</column>
		<column>
			<name>density</name>
			<unit>veh/km</unit>
			<type>float</type>				
		</column>
		<column>
			<name>flow</name>
			<unit>veh/h</unit>
			<type>float</type>				
		</column>	
		<column>
			<name>travel time</name>
			<unit>s</unit>
			<type>float</type>				
		</column>								
	</columns>	
</metadata>
